Title	Authors	Pdf	Presentation	Volume_Name	Notes
Frontmatter			https://aclanthology.org/www.mt-archive.info/MTS-2007-WS-1-complete.pdf		Patent translation
WIPO’s activities in patent translation and terminology	Rachel Chrem		https://aclanthology.org/www.mt-archive.info/MTS-2007-Chrem.pdf		Patent translation
English-Korean patent system: fromTo-EK/PAT	Oh-Woog Kwon and Sung-Kwon Choi and Ki-Young Lee and Yoon-Hyung Roh and Young-Gil Kim and Munpyo Hong	https://aclanthology.org/www.mt-archive.info/MTS-2007-Kwon.pdf			Patent translation
Phrase alignment for integration of SMT and RBMT resources	Akira Ushioda	https://aclanthology.org/www.mt-archive.info/MTS-2007-Ushioda.pdf			Patent translation
Rule based machine translation combined with statistical post editor for Japanese to English patent translation	Ehara Terumasa	https://aclanthology.org/www.mt-archive.info/MTS-2007-Ehara.pdf			Patent translation
Patent documentation – comparison of two MT strategies	Lene Offersgaard and Claus Povlsen	https://aclanthology.org/www.mt-archive.info/MTS-2007-Offersgaard.pdf			Patent translation
Error correcting system for analysis of Japanese patent sentences	Yokoyama Shoichi and Kennendai Shigehiro	https://aclanthology.org/www.mt-archive.info/MTS-2007-Yokoyama.pdf			Patent translation
On portability of resources for a quick ramp up of multilingual MT of patent claims	Svetlana Sheremetyeva	https://aclanthology.org/www.mt-archive.info/MTS-2007-Sheremetyeva.pdf			Patent translation
