Title	Authors	Pdf	Presentation	Volume_Name	Notes
Methods for Smoothing the Optimizer Instability in SMT	Mauro Cettolo and Nicola Bertoldi and Marcello Federico	https://aclanthology.org/www.mt-archive.info/10/MTS-2011-Cettolo.pdf			Papers
Training Machine Translation with a Second-Order Taylor Approximation of Weighted Translation Instances	Aaron Phillips and Ralf Brown	https://aclanthology.org/www.mt-archive.info/10/MTS-2011-Phillips.pdf			Papers
Maximum Rank Correlation Training for Statistical Machine Translation	Daqi Zheng and Yifan He and Yang Liu and Qun Liu	https://aclanthology.org/www.mt-archive.info/10/MTS-2011-Zheng-1.pdf			Papers
POS Tagging of English Particles for Machine Translation	Jianjun Ma and Degen Huang and Haixia Liu and Wenfeng Sheng	https://aclanthology.org/www.mt-archive.info/10/MTS-2011-Ma-1.pdf			Papers
Multi-stage Chinese Dependency Parsing Based on Dependency Direction	Wenjing Lang and Qiaoli Zhou and Guiping Zhang and Dongfeng Cai	https://aclanthology.org/www.mt-archive.info/10/MTS-2011-Lang.pdf			Papers
Statistic Machine Translation Boosted with Spurious Word Deletion	Shujie Liu and Chi-Ho Li and Ming Zhou	https://aclanthology.org/www.mt-archive.info/10/MTS-2011-Liu-1.pdf			Papers
Phonetic Representation-Based Speech Translation	Jie Jiang and Zeeshan Ahmed and Julie Carson-Berndsen and Peter Cahill and Andy Way	https://aclanthology.org/www.mt-archive.info/10/MTS-2011-Jiang-1.pdf			Papers
Unsupervised Vocabulary Selection for Domain-Independent Simultaneous Lecture Translation	Paul Maergner and Ian Lane and Alex Waibel	https://aclanthology.org/www.mt-archive.info/10/MTS-2011-Maergner.pdf			Papers
Context-aware Language Modeling for Conversational Speech Translation	Avneesh Saluja and Ian Lane and Ying Zhang	https://aclanthology.org/www.mt-archive.info/10/MTS-2011-Saluja.pdf			Papers
Incremental Training and Intentional Over-fitting of Word Alignment	Qin Gao and Will Lewis and Chris Quirk and Mei-Yuh Hwang	https://aclanthology.org/www.mt-archive.info/10/MTS-2011-Gao.pdf			Papers
Alignment Inference and Bayesian Adaptation for Machine Translation	Kevin Duh and Katsuhito Sudoh and Tomoharu Iwata and Hajime Tsukada	https://aclanthology.org/www.mt-archive.info/10/MTS-2011-Duh.pdf			Papers
Multi-Strategy Approaches to Active Learning for Statistical Machine Translation	Vamshi Ambati and Stephan Vogel and Jaime Carbonell	https://aclanthology.org/www.mt-archive.info/10/MTS-2011-Ambati.pdf			Papers
Document-level Consistency Verification in Machine Translation	Tong Xiao and Jingbo Zhu and Shujie Yao and Hao Zhang	https://aclanthology.org/www.mt-archive.info/10/MTS-2011-Xiao.pdf			Papers
Function Word Generation in Statistical Machine Translation Systems	Lei Cui and Dongdong Zhang and Mu Li and Ming Zhou	https://aclanthology.org/www.mt-archive.info/10/MTS-2011-Cui.pdf			Papers
Multimodal Building of Monolingual Dictionaries for Machine Translation by Non-Expert Users	Miquel Esplà-Gomis and Sánchez-Cartagena, Víctor M. and Pérez-Ortiz, Juan Antonio	https://aclanthology.org/www.mt-archive.info/10/MTS-2011-Espla-Gomis-1.pdf			Papers
Automatic Post-Editing based on SMT and its selective application by Sentence-Level Automatic Quality Evaluation	Hirokazu Suzuki	https://aclanthology.org/www.mt-archive.info/10/MTS-2011-Suzuki.pdf			Papers
Qualitative Analysis of Post-Editing for High Quality Machine Translation	Frédéric Blain and Jean Senellart and Holger Schwenk and Mirko Plitt and Johann Roturier	https://aclanthology.org/www.mt-archive.info/10/MTS-2011-Blain.pdf			Papers
Using machine translation in computer-aided translation to suggest the target-side words to change	Miquel Esplà-Gomis and Felipe Sánchez-Martínez and Forcada, Mikel L.	https://aclanthology.org/www.mt-archive.info/10/MTS-2011-Espla-Gomis-2.pdf			Papers
A Unified SMT Framework Combining MIRA and MERT	Shujie Liu and Chi-Ho Li and Ming Zhou	https://aclanthology.org/www.mt-archive.info/10/MTS-2011-Liu-2.pdf			Papers
Improving Phrase Extraction via MBR Phrase Scoring and Pruning	Nan Duan and Mu Li and Ming Zhou and Lei Cui	https://aclanthology.org/www.mt-archive.info/10/MTS-2011-Duan.pdf			Papers
Phrase Segmentation Model using Collocation and Translational Entropy	Hyoung-Gyu Lee and Joo-Young Lee and Min-Jeong Kim and Hae-Chang Rim and Joong-Hwi Shin and Young-Sook Hwang	https://aclanthology.org/www.mt-archive.info/10/MTS-2011-Lee.pdf			Papers
Singular or Plural? Exploiting Parallel Corpora for Chinese Number Prediction	Elizabeth Baran and Nianwen Xue	https://aclanthology.org/www.mt-archive.info/10/MTS-2011-Baran.pdf			Papers
Handling Multiword Expressions in Phrase-Based Statistical Machine Translation	Santanu Pal and Tanmoy Chakraborty and Sivaji Bandyopadhyay	https://aclanthology.org/www.mt-archive.info/10/MTS-2011-Pal.pdf			Papers
Automatic Error Analysis for Morphologically Rich Languages	El Kholy, Ahmed and Nizar Habash	https://aclanthology.org/www.mt-archive.info/10/MTS-2011-ElKholy.pdf			Papers
MT use within the enterprise: Encouraging adoption via a unified MT API	Raymond Flournoy	https://aclanthology.org/www.mt-archive.info/10/MTS-2011-Flournoy.pdf			Papers
Deploying MT into a Localisation Workflow: Pains and Gains	Yanli Sun and Juan Liu and Yi Li	https://aclanthology.org/www.mt-archive.info/10/MTS-2011-Sun.pdf			Papers
Evaluation of MT Systems to Translate User Generated Content	Johann Roturier and Anthony Bensadoun	https://aclanthology.org/www.mt-archive.info/10/MTS-2011-Roturier.pdf			Papers
A Unified and Discriminative Soft Syntactic Constraint Model for Hierarchical Phrase-based Translation	Lemao Liu and Tiejun Zhao and Chao Wang and Hailong Cao	https://aclanthology.org/www.mt-archive.info/10/MTS-2011-Liu-3.pdf			Papers
Simple but Effective Approaches to Improving Tree-to-tree Model	Feifei Zhai and Jiajun Zhang and Yu Zhou and Chengqing Zong	https://aclanthology.org/www.mt-archive.info/10/MTS-2011-Zhai.pdf			Papers
Unpacking and Transforming Feature Functions: New Ways to Smooth Phrase Tables	Boxing Chen and Roland Kuhn and George Foster and Howard Johnson	https://aclanthology.org/www.mt-archive.info/10/MTS-2011-Chen-1.pdf			Papers
Identification and Translation of Significant Patterns for Cross-Domain SMT Applications	Han-Bin Chen and Hen-Hsen Huang and Jengwei Tjiu and Ching-Ting Tan and Hsin-Hsi Chen	https://aclanthology.org/www.mt-archive.info/10/MTS-2011-Chen-2.pdf			Papers
Domain Adaptation in Statistical Machine Translation of User-Forum Data using Component Level Mixture Modelling	Pratyush Banerjee and Naskar, Sudip Kumar and Johann Roturier and Andy Way and van Genabith, Josef	https://aclanthology.org/www.mt-archive.info/10/MTS-2011-Banerjee.pdf			Papers
Bagging-based System Combination for Domain Adaption	Linfeng Song and Haitao Mi and Yajuan Lü and Qun Liu	https://aclanthology.org/www.mt-archive.info/10/MTS-2011-Song.pdf			Papers
Extracting Pre-ordering Rules from Chunk-based Dependency Trees for Japanese-to-English Translation	Xianchao Wu and Katsuhito Sudoh and Kevin Duh and Hajime Tsukada and Masaaki Nagata	https://aclanthology.org/www.mt-archive.info/10/MTS-2011-Xu.pdf			Papers
Statistical Post-Editing for a Statistical MT System	Hanna Bechara and Yanjun Ma and van Genabith, Josef	https://aclanthology.org/www.mt-archive.info/10/MTS-2011-Bechara.pdf			Papers
Post-ordering in Statistical Machine Translation	Katsuhito Sudoh and Xianchao Wu and Kevin Duh and Hajime Tsukada and Masaaki Nagata	https://aclanthology.org/www.mt-archive.info/10/MTS-2011-Sudoh.pdf			Papers
Searching Translation Memories for Paraphrases	Masao Utiyama and Graham Neubig and Takashi Onishi and Eiichiro Sumita	https://aclanthology.org/www.mt-archive.info/10/MTS-2011-Utiyama.pdf			Papers
Are numbers good enough for you? - A linguistically meaningful MT evaluation method	Takako Aikawa and Spencer Rarrick	https://aclanthology.org/www.mt-archive.info/10/MTS-2011-Aikawa.pdf			Papers
Marker-based Chunking for Analogy-based Translation of Chunks	Kota Takeya and Yves Lepage	https://aclanthology.org/www.mt-archive.info/10/MTS-2011-Takeya.pdf			Papers
A Comparison of Unsupervised Bilingual Term Extraction Methods Using Phrase-Tables	Masamichi Ideue and Kazuhide Yamamoto and Masao Utiyama and Eiichiro Sumita	https://aclanthology.org/www.mt-archive.info/10/MTS-2011-Ideue.pdf			Papers
Improving Low-Resource Statistical Machine Translation with a Novel Semantic Word Clustering Algorithm	Jeff Ma and Spyros Matsoukas and Richard Schwartz	https://aclanthology.org/www.mt-archive.info/10/MTS-2011-Ma-2.pdf			Papers
Multi-granularity Word Alignment and Decoding for Agglutinative Language Translation	Zhiyang Wang and Yajuan Lü and Qun Liu	https://aclanthology.org/www.mt-archive.info/10/MTS-2011-Wang.pdf			Papers
Improving the Hierarchical Phrase-Based Translation Model	Xiaodong Shi and Xiang Zhu and Yidong Chen	https://aclanthology.org/www.mt-archive.info/10/MTS-2011-Shi.pdf			Papers
Lexical-based Reordering Model for Hierarchical Phrase-based Machine Translation	Zhongguang Zheng and Yao Meng and Hao Yu	https://aclanthology.org/www.mt-archive.info/10/MTS-2011-Zheng-2.pdf			Papers
Effective Use of Discontinuous Phrases for Hierarchical Phrase-based Translation	Wei Wei and Bo Xu	https://aclanthology.org/www.mt-archive.info/10/MTS-2011-Wei.pdf			Papers
Generating Virtual Parallel Corpus: A Compatibility Centric Method	Jia Xu and Weiwei Sun	https://aclanthology.org/www.mt-archive.info/10/MTS-2011-Xu.pdf			Papers
Parallel Corpus Refinement as an Outlier Detection Algorithm	Kaveh Taghipour and Shahram Khadivi and Jia Xu	https://aclanthology.org/www.mt-archive.info/10/MTS-2011-Taghipour.pdf			Papers
MT Detection in Web-Scraped Parallel Corpora	Spencer Rarrick and Chris Quirk and Will Lewis	https://aclanthology.org/www.mt-archive.info/10/MTS-2011-Rarrick.pdf			Papers
On the Expressivity of Linear Transductions	Markus Saers and Dekai Wu and Chris Quirk	https://aclanthology.org/www.mt-archive.info/10/MTS-2011-Saers.pdf			Papers
Handheld Machine Translation System Based on Constraint Synchronous Grammar	Fai Wong and Francisco Oliveira and Sam Chao and Chi-Wai Tang	https://aclanthology.org/www.mt-archive.info/10/MTS-2011-Wong-1.pdf			Papers
A Comparison Study of Parsers for Patent Machine Translation	Isao Goto and Masao Utiyama and Takashi Onishi and Eiichiro Sumita	https://aclanthology.org/www.mt-archive.info/10/MTS-2011-Goto.pdf			Papers
Rich Linguistic Features for Translation Memory-Inspired Consistent Translation	Yifan He and Yanjun Ma and Andy Way and van Genabith, Josef	https://aclanthology.org/www.mt-archive.info/10/MTS-2011-He.pdf			Papers
Japanese-Chinese Phrase Alignment Using Common Chinese Characters Information	Chenhui Chu and Toshiaki Nakazawa and Sadao Kurohashi	https://aclanthology.org/www.mt-archive.info/10/MTS-2011-Chu.pdf			Papers
The Cultivation of a Chinese-English-Japanese Trilingual Parallel Corpus from Comparable Patents	Bin Lu and Chow, Ka Po and Tsou, Benjamin K.	https://aclanthology.org/www.mt-archive.info/10/MTS-2011-Lu.pdf			Papers
Evaluation Methodology and Results for English-to-Arabic MT	Olivier Hamon and Khalid Choukri	https://aclanthology.org/www.mt-archive.info/10/MTS-2011-Hamon.pdf			Papers
Example-Based Machine Translation for Low-Resource Language Using Chunk-String Templates	Khan, Md. Anwarus Salam and Setsuo Yamada and Tetsuro Nishino	https://aclanthology.org/www.mt-archive.info/10/MTS-2011-Anwarus-Salam.pdf			Papers
Improve SMT with Source-Side “Topic-Document” Distributions	Zhengxian Gong and Guodong Zhou and Liangyou Li	https://aclanthology.org/www.mt-archive.info/10/MTS-2011-Gong.pdf			Papers
Predicting Machine Translation Adequacy	Lucia Specia and Najeh Hajlaoui and Catalina Hallett and Wilker Aziz	https://aclanthology.org/www.mt-archive.info/10/MTS-2011-Specia.pdf			Papers
Getting Expert Quality from the Crowd for Machine Translation Evaluation	Luisa Bentivogli and Marcello Federico and Giovanni Moretti and Michael Paul	https://aclanthology.org/www.mt-archive.info/10/MTS-2011-Bentivogli.pdf			Papers
A Framework for Diagnostic Evaluation of MT Based on Linguistic Checkpoints	Naskar, Sudip Kumar and Antonio Toral and Federico Gaspari and Andy Way	https://aclanthology.org/www.mt-archive.info/10/MTS-2011-Naskar.pdf			Papers
Comparative Evaluation of Term Informativeness Measures in Machine Translation Evaluation Metrics	Billy Wong and Chunyu Kit	https://aclanthology.org/www.mt-archive.info/10/MTS-2011-Wong-2.pdf			Papers
System Combination for Machine Translation Based on Text-to-Text Generation	Wei-Yun Ma and Kathleen Mckeown	https://aclanthology.org/www.mt-archive.info/10/MTS-2011-Ma-3.pdf			Papers
Hybrid Machine Translation Guided by a Rule–Based System	Cristina España-Bonet and Gorka Labaka and Díaz de Ilarraza, Arantza and Lluís Màrquez	https://aclanthology.org/www.mt-archive.info/10/MTS-2011-Espana-Bonet-1.pdf			Papers
Integrating shallow-transfer rules into phrase-based statistical machine translation	Sánchez-Cartagena, Víctor M. and Felipe Sánchez-Martínez and Pérez-Ortiz, Juan Antonio	https://aclanthology.org/www.mt-archive.info/10/MTS-2011-Sanchez-Cartagena.pdf			Papers
Hypergraph Training and Decoding of System Combination in SMT	Yupeng Liu and Tiejun Zhao and Sheng Li	https://aclanthology.org/www.mt-archive.info/10/MTS-2011-Liu-4.pdf			Papers
Study on the Impact Factors of the Translators' Post-editing Efficiency in a Collaborative Translation Environment	Na Ye and Guiping Zhang	https://aclanthology.org/www.mt-archive.info/10/MTS-2011-Ye.pdf			Papers
UTX 1.11, a Simple and Open User Dictionary/Terminology Standard, and its Effectiveness with Multiple MT Systems	Seiji Okura and Yuji Yamamoto and Hajime Ito and Michael Kato and Miwako Shimazu	https://aclanthology.org/www.mt-archive.info/10/MTS-2011-Okura.pdf			Papers
Real-time Multi-media Translation for Healthcare: a Usability Study	Mark Seligman and Mike Dillinger	https://aclanthology.org/www.mt-archive.info/10/MTS-2011-Seligman.pdf			Papers
