Title	Authors	Pdf	Presentation	Notes	Pagenumbers	Publisher
MT-based transparent Arabization of the Internet TARJIM.COM	Achraf Chalabi			System descriptions	189-191	Springer
The KANTOO machine translation environment	Eric Nyberg and Teruko Mitamura			System descriptions	192-195	Springer
Pacific Rim portable translator	John Weisgerber and Jin Yang and Pete Fisher			System descriptions	196-201	Springer
LabelTool: a localization application for devices with restricted display areas	Jimmy C.M. Lu and Lars Åkerman and Karin Spalink			System descriptions	202-208	Springer
The LogoVista ES translation system	Nan Decker			System descriptions	209-212	Springer
L&H lexicography toolkit for machine translation	Timothy Meekhof and David Clements			System descriptions	213-218	Springer
A new look for the PAHO MT system	Marjorie León			System descriptions	219-222	Springer
